{
  "$schema": "./shadow-scoring-artifact.schema.json",
  "format": "redact-secret/shadow-scoring-artifact/1",
  "artifact": {
    "id": "redact-secret/shadow-scoring-artifact",
    "revision": 5
  },
  "status": "reviewed",
  "contract": {
    "decision": "decision-freeze-the-shadow-evidence-score-and-confidence-contract",
    "decisionPath": "docs/decisions/2026-09-25-freeze-the-shadow-evidence-score-and-confidence-contract.md",
    "spec": "docs/specs/engine.md#shadow-scoring-artifact"
  },
  "use": {
    "shadowOnly": true,
    "enforcing": false,
    "publicApi": false,
    "findingFields": [],
    "loadedAtRuntime": false,
    "shippedInPackages": false,
    "runtimeLearning": false,
    "remoteCalibration": false,
    "securityDependsOnSecrecy": false
  },
  "model": {
    "featureSchema": {
      "id": "evidence-features/v2",
      "maxAnalysedChars": 256,
      "maxAutocorrelationLag": 32,
      "fixedPointFractionBits": 16,
      "features": ["byte_len", "analysed_chars", "truncated", "distinct_symbols", "max_symbol_count", "shannon_entropy_q16", "min_entropy_q16", "information_bits_q16", "class_lower", "class_upper", "class_digit", "class_symbol", "class_space_control", "class_non_ascii", "class_count", "class_transitions", "class_alphabet_size", "entropy_efficiency_permille", "alphabet_efficiency_permille", "distinct_ratio_permille", "length_permille", "longest_run", "adjacent_repeat_permille", "repeated_bigram_permille", "smallest_period", "max_autocorrelation_permille", "max_autocorrelation_lag", "residual_symbols", "residual_entropy_q16", "residual_min_entropy_q16"],
      "goldenVectors": [
        {"input": "", "vector": [0, 0, 0, 0, 0, 0, 0, 0, 0, 0, 0, 0, 0, 0, 0, 0, 0, 0, 0, 0, 0, 0, 0, 0, 0, 0, 0, 0, 0, 0]},
        {"input": "aaaaaaaaaaaaaaaa", "vector": [16, 16, 0, 1, 16, 0, 0, 0, 16, 0, 0, 0, 0, 0, 1, 0, 26, 0, 0, 62, 62, 16, 1000, 933, 1, 1000, 2, 1, 0, 0]},
        {"input": "abcabcabcabcabcabc", "vector": [18, 18, 0, 3, 6, 103872, 103872, 1869696, 18, 0, 0, 0, 0, 0, 1, 0, 26, 1000, 337, 166, 70, 1, 0, 823, 3, 1000, 3, 4, 65536, 65536]},
        {"input": "XXXX-XXXX-XXXX-XXXX", "vector": [19, 19, 0, 2, 16, 41239, 16248, 783541, 0, 16, 0, 3, 0, 0, 2, 6, 58, 629, 107, 105, 74, 4, 666, 833, 5, 1000, 5, 2, 65536, 65536]},
        {"input": "Q7vK2mZp9LxR4tWb8NcY3hJd6FsG1eUa", "vector": [32, 32, 0, 32, 1, 327680, 327680, 10485760, 12, 12, 8, 0, 0, 0, 3, 31, 62, 1000, 839, 1000, 125, 1, 0, 0, 0, 0, 0, 32, 327680, 327680]},
        {"input": "\ud83d\ude00a\ud83d\ude03b\ud83d\ude00a\ud83d\ude03b", "vector": [20, 8, 0, 4, 2, 131072, 131072, 1048576, 4, 0, 0, 0, 0, 4, 2, 7, 28, 1000, 416, 500, 31, 1, 0, 428, 4, 1000, 4, 6, 125718, 103872]},
        {"input": "ab", "vector": [2, 2, 0, 2, 1, 65536, 65536, 131072, 2, 0, 0, 0, 0, 0, 1, 0, 26, 1000, 212, 1000, 7, 1, 0, 0, 0, 0, 0, 2, 65536, 65536]},
        {"input": "aabc", "vector": [4, 4, 0, 3, 2, 98304, 65536, 393216, 4, 0, 0, 0, 0, 0, 1, 0, 26, 946, 319, 750, 15, 2, 333, 0, 0, 0, 0, 2, 65536, 65536]}
      ]
    },
    "aggregation": {
      "id": "evidence-aggregation/v3",
      "featureSchema": "evidence-features/v2",
      "maxGroupSignals": 4,
      "groups": [
        {
          "group": "randomness",
          "direction": "positive",
          "rule": "halving-diminishing-returns",
          "cap": 30,
          "signals": [
            {"kind": "feature-ramp", "signal": "residual_entropy_q16", "feature": 28, "lo": 234123, "hi": 263562, "max": 30}
          ]
        },
        {
          "group": "lexical",
          "direction": "positive",
          "rule": "halving-diminishing-returns",
          "cap": 0,
          "signals": []
        },
        {
          "group": "contextual",
          "direction": "positive",
          "rule": "halving-diminishing-returns",
          "cap": 50,
          "signals": [
            {"kind": "context", "signal": "credential-context", "classes": ["credential-name", "authorization-header", "url-userinfo"], "points": 50}
          ]
        },
        {
          "group": "validation",
          "direction": "positive",
          "rule": "halving-diminishing-returns",
          "cap": 50,
          "signals": []
        },
        {
          "group": "negative",
          "direction": "negative",
          "rule": "halving-diminishing-returns",
          "cap": 130,
          "signals": [
            {"kind": "strict-exclusion", "signal": "strict-exclusion", "points": 130}
          ]
        }
      ],
      "bands": {
        "low": 35,
        "medium": 40,
        "high": 51
      },
      "contextClasses": ["url-userinfo", "authorization-header", "credential-name", "other-name", "bare"],
      "credentialNameSignals": ["high-signal-name", "ambiguous-name"],
      "exclusionGrammars": ["template-reference", "environment-reference", "command-substitution", "angle-placeholder", "mask", "placeholder-vocabulary"],
      "placeholderWords": ["a", "access", "an", "api", "auth", "change", "changeme", "client", "dummy", "example", "fake", "goes", "here", "id", "insert", "key", "me", "my", "nil", "none", "null", "password", "placeholder", "redacted", "replace", "replaceme", "sample", "secret", "tbd", "the", "todo", "token", "undefined", "value", "your"],
      "placeholderMarkers": ["changeme", "dummy", "example", "fake", "here", "insert", "nil", "none", "null", "placeholder", "redacted", "replace", "replaceme", "sample", "tbd", "todo", "undefined", "your"],
      "maskSymbols": ["*", "x", "X", "\u2022", "#", ".", "-", "0"],
      "minMaskLength": 3
    }
  },
  "modelFingerprint": "db9fe32e29e52fc9f85713cfb986b6675b57afca6acf062734ada5c69e0162c4",
  "identityLedger": [
    {
      "model": "evidence-aggregation/v1",
      "featureSchema": "evidence-features/v1",
      "modelFingerprint": "bf2ed67db72dabe69b97d248e547aa1e942cf98991a6b712dc6285629662afa9",
      "introducedInRevision": 1
    },
    {
      "model": "evidence-aggregation/v2",
      "featureSchema": "evidence-features/v1",
      "modelFingerprint": "4104fb2c6f046169f63e991dd7594c099af5fcea01deecae7afe1c7015579975",
      "introducedInRevision": 3
    },
    {
      "model": "evidence-aggregation/v3",
      "featureSchema": "evidence-features/v2",
      "modelFingerprint": "db9fe32e29e52fc9f85713cfb986b6675b57afca6acf062734ada5c69e0162c4",
      "introducedInRevision": 5
    }
  ],
  "sources": {
    "spec": [
      {
        "path": "docs/specs/engine.md",
        "section": "Shadow evidence feature schema",
        "sha256": "5973c396b1bf561f1e8987abf52ca7a1095ff120c86cbbf13ed364f52200c019"
      },
      {
        "path": "docs/specs/engine.md",
        "section": "Shadow evidence residual features",
        "sha256": "f62966e4f55b59b2fcc227b3b7709d3d46298135ffb507ca33083cae05738a63"
      },
      {
        "path": "docs/specs/engine.md",
        "section": "Shadow evidence aggregation",
        "sha256": "1211277d9d48885e918710e2e985838afee38ec3c772d9bfea30b6a11f2a10f6"
      },
      {
        "path": "docs/specs/engine.md",
        "section": "Maintainer-local shadow evaluation",
        "sha256": "19dc1157355aeacb0fd402a00a351b24509560bb6ddcfc0166530f96d78f9365"
      }
    ],
    "code": [
      {
        "path": "crates/secret-scan-core/src/evidence/features.rs",
        "sha256": "8d4d1269e94e90d972fe4d1a1578851f39ed68a965f938cfc8d9bcc6b0df9882"
      },
      {
        "path": "crates/secret-scan-core/src/evidence/residual.rs",
        "sha256": "0c50668ab327406a6068abbb5448bfaf9acfa5af196751a0e9b85613ec592248"
      },
      {
        "path": "crates/secret-scan-core/src/evidence/fixed_point.rs",
        "sha256": "7a5cb4dcc66c8d055fa203c5a009db042434acdd37076b6b121269f145276f89"
      },
      {
        "path": "crates/secret-scan-core/src/evidence/context.rs",
        "sha256": "33571857934a0408edf7932ce28290956ce5f3cae934d7b39b07dd3907f33060"
      },
      {
        "path": "crates/secret-scan-core/src/evidence/exclusion.rs",
        "sha256": "9a5b43264407cc4957be3efb666f708127e9851eba10e96f1eb63ba16406c39c"
      },
      {
        "path": "crates/secret-scan-core/src/evidence/aggregate.rs",
        "sha256": "ca6288d52dbaeeefd414e56d3fa30c7b2ae5aa6b6c5aa079db21b195f100ff22"
      },
      {
        "path": "crates/secret-scan-core/src/evidence/shadow.rs",
        "sha256": "c339e115a0d7e23dc8038de190df4969525fb53f1ca4e973c45c58fdd88882d6"
      }
    ]
  },
  "calibration": {
    "repository": "redact-secret/redact-secret-benchmarks",
    "issue": 829,
    "pullRequest": 437,
    "branch": "develop",
    "commit": "5823751c16df4776035f5a0bd6f9640f8013a6a7",
    "method": "https://github.com/redact-secret/redact-secret-benchmarks/blob/5823751c16df4776035f5a0bd6f9640f8013a6a7/docs/specs/calibration-experiments.md",
    "experimentVersion": "calibration-experiments/2",
    "selectedConfiguration": "halving-q1-l0-r30-l0-c50",
    "selection": {
      "method": "calibration-experiments/2:dev-balanced-error-within-tolerance,fewest-parameters,loco-stability",
      "sourceHash": "b906f0c17a18e7533cd477e1815d169ae0d2fdc81f112a61020449cfb7c9c056",
      "seed": "none"
    },
    "featureDataset": {
      "schemaVersion": 1,
      "extractorVersion": "candidate-features/3",
      "extractorSourceHash": "cba5a01cbdc95d2cb5b3ae70235724eae95bedb6f74a712bbcc236c281343644",
      "datasetHash": "2241d655096403d7f6a2b16201c2d4614bb39d2520a75734ec9958941cde172d",
      "featureSchema": "evidence-features/v2",
      "productFeatureSource": {
        "repository": "redact-secret/redact-secret",
        "commit": "21509e903e540ece5966e4ed4d6d1a77a0a14ce8",
        "pinnedBy": "https://github.com/redact-secret/redact-secret-benchmarks/blob/5823751c16df4776035f5a0bd6f9640f8013a6a7/benchmarks/lib/evidence-features.ts"
      }
    },
    "scoring": {
      "contractDecision": "decision-freeze-the-shadow-evidence-score-and-confidence-contract",
      "featureSchemaVersion": "evidence-features/v2",